{
  "schema_version": 1,
  "evidence_id": "EVD-EXAMPLE",
  "run_id": "RUN-EXAMPLE",
  "outcome": "passed",
  "checks": [
    {
      "name": "Targeted tests",
      "status": "passed",
      "exit_code": 0,
      "started_at": "2026-09-06T00:00:00Z",
      "finished_at": "2026-09-06T00:01:00Z"
    }
  ]
}
